{
  "schema_version": "1.0.0",
  "intake_id": "oint-20261001T000000000Z-00000000",
  "remote_reference": "registry.example.invalid/skill/example:0.0.0",
  "staging_directory": "unverified/oci-inlet/example",
  "manifest_digest": "sha256:0000000000000000000000000000000000000000000000000000000000000000",
  "layer_digests_verified": false,
  "signature_verified": false,
  "quarantine_assessment": {
    "status": "SUSPECT",
    "reasons": ["Documentation fixture only; package bytes and publisher identity have not been verified."]
  },
  "intake_verdict": "REVIEW_REQUIRED_UNAUTHENTICATED",
  "user_approval_required": true,
  "auto_activated": false,
  "created_utc": "2026-09-01T17:15:00Z"
}
